parameter,filenames_to_concatenate,ngrams_to_replace,hold_filenames,hold_instances_number,filter_unique_results,type,match_instances_with_other_parameter,check_parameter_relations,parameters_used_to_filter
nanomaterial_composition,"( 2dmaterials_02, carbonmaterials_01, carbonmaterials_04, carbonmaterials_06, metallic_nano_01, metallic_nano_02, oxidesmaterials_01, qdots_01)","( elements name symbol, inorganic compounds name symbol, nanomaterial composition )",FALSE,FALSE,True,textual,None,FALSE,None
nanomaterial_morphology,"( 2dmaterials_04, carbonmaterials_02, carbonmaterials_03, carbonmaterials_05, metallic_nano_03, metallic_nano_04, oxidesmaterials_02, qdots_02)",( nanomaterial morphology ),TRUE,FALSE,True,textual,None,TRUE,"(nanomaterial_composition, nanomaterial_morphology, biological_species, toxicity_endpoints, toxicity_yes_no)"
biological_species,"(species_athaliana_21, species_celegans_21, species_dmagna_21, species_drerio_21)",( extract species ),TRUE,FALSE,True,textual,None,TRUE,"(nanomaterial_composition, nanomaterial_morphology, biological_species, toxicity_endpoints, toxicity_yes_no)"
toxicity_endpoints,"(species_athaliana_03, species_athaliana_05, species_athaliana_07, species_athaliana_09, species_athaliana_11, species_athaliana_13, species_athaliana_15, species_athaliana_17, species_athaliana_19, species_celegans_03, species_celegans_05, species_celegans_07, species_celegans_09, species_celegans_11, species_celegans_13, species_celegans_15, species_celegans_17, species_celegans_19, species_dmagna_03, species_dmagna_05, species_dmagna_07, species_dmagna_09, species_dmagna_11, species_dmagna_13, species_dmagna_15, species_dmagna_17, species_dmagna_19, species_drerio_03, species_drerio_05, species_drerio_07, species_drerio_09, species_drerio_11, species_drerio_13, species_drerio_15, species_drerio_17, species_drerio_19)",( toxicity_endpoints ),TRUE,FALSE,True,textual,None,FALSE,None
toxicity_yes_no,"(species_athaliana_04, species_athaliana_06, species_athaliana_08, species_athaliana_10, species_athaliana_12, species_athaliana_14, species_athaliana_16, species_athaliana_18, species_athaliana_20, species_celegans_04, species_celegans_06, species_celegans_08, species_celegans_10, species_celegans_12, species_celegans_14, species_celegans_16, species_celegans_18, species_celegans_20, species_dmagna_04, species_dmagna_06, species_dmagna_08, species_dmagna_10, species_dmagna_12, species_dmagna_14, species_dmagna_16, species_dmagna_18, species_dmagna_20, species_drerio_04, species_drerio_06, species_drerio_08, species_drerio_10, species_drerio_12, species_drerio_14, species_drerio_16, species_drerio_18, species_drerio_20)",None,TRUE,FALSE,False,textual,None,TRUE,"(nanomaterial_composition, nanomaterial_morphology, biological_species, toxicity_endpoints, toxicity_yes_no)"
